Unnamed: 0,Free_text,Label_id
2155,thông_tin bệnh_nhân con_số thống bệnh_nhân yếu_tố dịch_tễ triệu_chứng điển_hình_như xét_nghiệm cách_ly xét bệnh_nhân lây_lan,0
2156,nhấn fati ăn_mừng kiểu ronaldo,0
2157,ca mập kẻ đấy,0
2158,có_lẽ cảm_nhận điển ảnh phim nội_dung tình_tiết nội_dung bế_tắc dường_như kết phim vẻ hơi cường_điệu_hóa khu nghèo khu khu mê đề đứa trẻ cò đề nổi khóc liệt kiểu lẻ phim_ảnh vẻ hơi thưc tế rạp bật đèn rạp lẻ phim chúc_mừng ekip đoàn phim thành_công rực_rỡ,1
2159,bayem,0
2160,cơ_quan_chức_năng ngiêm túc quy_trình phòng_chống dịch đề kiểm_tra giám_sát quán_triệt tinh_thần phòng_dịch thường_xuyên phân_công quy trách_nhiệm rõ_ràng lãnh_đạo chủ_quan lỏng quy_trình xảy dịch_bệnh chế_tài xử_phạt hiệu_quả hô_hào xuông chế_tài thưởng_phạt rõ_ràng sai_sót chủ_quan buông_lỏng quy_trình hậu_quả khắc_phục ảnh_hưởng kinh_tế,0
2161,may_mắn tê_tê đời_nào,0
2162,quản_lý nhập_cảnh ổn,0
2163,có_lẽ định_dạng thuật_ngữ học toán miếng giấy hình tam_giác gói kín bóng góc tam_giác tiệm cận vuông_góc cạnh đối_diện đoạn rõ_ràng tổng đường_cao,0
2164,trận mesi hờn_dỗi ghi_bàn fan cuồng pen si kiếm pen bc fati bc thay_thế mesi ronaldinho,1
2165,quỷ đội_lốt,1
2166,tiến kỉ_lục pele số_phận thử_thách mesi khắc_nghiệt chùn mesi mesi kỉ_lục vua bóng_đá pele vinh_quang mesi tuyệt_vời mesi,0
2167,đừng dại vàng đi tình_hình kinh_tế suy_thoái vàng kênh trú_ẩn an_toàn sinh đầu vàng usd ouce chúc may_mắn,0
2168,kia morning,0
2169,dự_định mua xe thay seltos,0
2170,chuẩn đều_đặn hàng vợ cằn_nhằn mấy câu ngơ_ngơ mất_hồn,0
2171,trẻ_em ao hồ sông suối bắt_buộc học bơi rơi xuống_nước,0
2172,đổi tuyệt_vời ngày_một tin_vui vnexpres,0
2173,dính scandal chia_tay vợ yên_lặng bóc phốt tin_tưởng chàng trai sống duyên vợ_chồng cứu_vãn chia_tay văn_minh có_lẽ vợ cũ tử_tế đàng_hoàng tóm cảm_tình anh_chàng vai diễn phim,0
2174,rải thuốc trừ cỏ thuốc_sâu cá đồng dân hạnh_phúc,0
2175,tối gái đi nửa phim kêu phí rạp phim nội_dung tiết thuyết_phục nội_dung tốn bỏng ngô li,1
2176,bến_xe phát thưởng hàng lộn_xộn,0
2177,đầu_tư máy sục khí tiền thời_buổi làm_ăn phụ_thuộc tựnhiên chết,0
2178,lỳ thua lửng mật,0
2179,kinh_khủng,1
2180,tình_huống sinh_tử sinh_vật phi_thường,0
2181,bs định diệu_kỳ cúi đầu đội ngủ y bác_sĩ chúc sức_khỏe,0
2182,loài chuyên xác động_vật chết biển,0
2183,thi kiểu đấy,0
2184,liều phát_huy tác_dụng trump trận chiến chúc ngài phu_nhân chóng_khỏe,0
2185,rắc_rối đánh_số đường hạn_hẹp biển tô,0
2186,xe thị_trường mỹ nút cốp phát trường_hợp vô_ý kẹt bắt_cóc,0
2187,hoẵng tang_thương,0
2188,mih gà rán mih jolibe ngon hợp_khẩu_vị ban_đầu kfc lote mih joli,0
2189,nhật siêu_cường châu gia_đình góp_mặt,0
2190,đùa,0
2191,băn_khoăn giảng bảo sách tham_khảo học_sinh mua sách tham_khảo đọc cấm,0
2192,câu cá cá húc chết sợ,0
2193,dịch_vụ sữa chữa uy_tín mong phát_triển canh tranh trang thương mai điện_tử dần thói_quen đi mua tiệm hỏng tiệm,0
2194,cháu chào xấu,0
2195,đeo khẩu_trang,0
2196,đường_bay quốc_tế giấy xét_nghiệm nhập_cảnh cách_ly tuần nhu đảm_bảo_an_toàn việt_nam,0
2197,mấy kĩ_năng,0
2198,bắc gió_mùa trẻ_con quanh khu mày ốm hàng_loạt,0
2199,cửa_hàng doanh_thu tỷ nghĩa_là thu_chi loanh_quanh triệu lãi mặt_bằng lương nhân_viên nhuận hơi lạ,0
2200,ủng_hộ chủ_trương long thi chứng_chỉ định_kì kiểm_tra năng_lực bs kiến_thức y_khoa cập_nhật hành_lang pháp_lí hội nghề_nghiệp thể_hiện vai_trò chuẩn_hóa nâng cao_trình_độ bác_sĩ chuyên_ngành bắt kịp xu_hướng phát_triển y_khoa thế_giới song_song cơ_chế chuẩn_hóa nâng cao_trình_độ lương tận_tâm nghề,0
2201,đàn_ông ăn_mặc hoa_hoét lòe loẹt xu_hướng thiên nữ_tính,1
2202,tiến barca,0
2203,thương tương_lai trẻ_em cực_kỳ ghi_nhớ hành_động biểu_hiện động_tác bé hình_thành thói_quen mong cha_mẹ bé vụ tình_thương giáo_dục bé,0
2204,trải nghiệm đi xe bao_gồm xe công_nhận fadil đi bốc chạy thử cảm_nhận êm prado,0
2205,vui buồn có_lẽ buồn ',0
2206,may_mắn thiện nguyện chúc sống bình an mong_muốn trở_lại cuộc_sống chúc thiện nguyện sức_khỏe,0
2207,phim coi vui lắm vui phim hài vui nhẹ_nhàng má tối toàn cải_lương coi phim xong phim hàn,1
2208,sống ích_kỉ phiền_toái xung_quanh sống,1
2209,đứng danh_sách người_ta quên,0
2210,khổng_lồ đi tiên_phong to concorde dự_án tiên_phong hiệu_quả mong tam bận dự_án máy_bay hydro thành_công mỹ_mãn,0
2211,hàn uống uống mua sảng phẩm hàn công_tác thế_giới,0
2212,thiên_thần charlie tuyệt_vời,0
2213,schalke si đội_hình ghi bàn danh_dự hậu_vệ chủ_quan mải si đi vuốt râu,0
2214,tranh_luận rõ_ràng trump chương_trình chris walace xử ép thiên_vị trump thét tranh_luận biden walace liên_tục biden quy_định biden liên_tục thông_tin sai_lệch chính_quyền trump trump nhảy cắt sửa công_bằng biden,0
2215,bồ đào cầu_thủ,0
2216,khắc_phục tạm_thời cao_ốc kia xây_dựng tiếc,0
2217,coi chăm_sóc cha_mẹ đòi_hỏi đòi đòi giành,0
2218,chê giáo_viên lỡ rút dao đâm lo gia_đình đường không_lẽ giáo_viên chào sinh,0
2219,xong phim ròm lớp ý_nghĩ tựa ký_sinh_trùng kết_thúc phim hơi khó_chịu suy_luận nhập_tâm phim kết_thúc có_hậu ròm ròm chuyến xe hành_trình sáng_sủa cuộc_đời thương nghèo bé sống vất_vưởng rìa xã_hội phồn_hoa tình_cảm gia_đình tình_cảm hàng_xóm cờ_bạc đề jack thành_phố sôi_nổi quê trải nghiệm chung_cư cũ xã_hội gói gọn đề con_số góc_quay phim nghệ_thuật chiều sâu chỗ mượt lắm tối sắp_xếp đi,0
2220,ngưỡng_mộ tình_yêu hai tình_yêu chân_thành chông_gai chúc gia_đình hạnh_phúc,0
2221,lay dai tam giac deu co chieu mm chieu dai cac canh anh_trai dat tinh,0
2222,video chúc quan_hệ phát_triển bến chặt,0
2223,câu đáp_án,0
2224,bong_bóng giá gấp mấy giá thực giá thực tịt mua giá toàn thánh ghen tức phấn_đấu mua,0
2225,mỹ trump mỹ đi_giải_quyết đòi công việc_làm dân mỹ trứng ổ thế_giới phụ_thuộc trung_quốc,0
2226,giá vàng phi_mã,0
2227,nghiệp giáo_viên tiếng cố_gắng kỳ thi tiếng đơn_thuần phương_tiện giao_tiếp sức_lực giành,1
2228,bỉ cực hồi thái_lai mong bình an khôn_lớn,0
2229,cá_trắm_đen chi mylopharyngodon nuôi thực_phẩm dược_phẩm ốc_sên ốc_nhồi cá_trắm cỏ cá_mè cá nuôi phổ_biến châu,0
2230,giá_thành thương nhập khẩuthe end,0
2231,giọng ca diễn hát đan trường chuc điện_thoại sức khoả,0
2232,tổng_thống mỹ bê_bối xấu_hổ tổn_hại hình_ảnh sự_nghiệp chính_trị trump bình_thường cân đường hộp sữa,0
2233,barca rút kinh_nghiệm vụ alphonso davies tuyển cầu_thủ bắc mỹ quốc_tịch canada davies barca chảnh chọe tiếc hùi_hụi chào_mừng dest hy_vọng thành_công barca mỹ thế_hệ cầu_thủ tuyệt_vời lịch_sử cầu_thủ trẻ thi_đấu đội bóng hàng_đầu châu âu vai_trò trụ_cột pulisic chelsea tyler adam leipzig reyna jr dortmund dest tương_lai hứa_hẹn,0
2234,đeo khẩu_trang mốt khẩu_trang vải màu xanh đen đen cá_tính mặc đồ bụi bụi đeo khẩu_trang thời_trang phết phối đẹp,0
2235,cũ ngoặc giấy_tờ áp_dụng đường dăm chục ngoạc đi,0
2236,xe lựa_chọn hợp_lí,0
2237,khả_năng mua xe khuyên hà_nội đồng_hồ cafe phố quan_sát đường_phố đếm tỉ_lệ xe đường quyết_định mua tiêu_dùng thông_thái tràng tiền đếm xe fortuner đi santafe quyết_định mua fortuner,0
2238,cầm_thú,1
2239,thần_tượng thần_tượng xưa,0
2240,thương_tâm trách_nhiệm,1
2241,đừng nhắc tỉ_số tan_nát gia_đình tan_nát rạp xiếc,0
2242,d prestwod say mặt,0
2243,chúc_mừng sinh_nhật con_gái bé tố_chất người_mẫu tương_lai,0
2244,việc_làm ý_nghĩa chúc sức_khỏe hạnh_phúc cám_ơn,0
2245,đài,0
2246,phụ_huynh học lớp năm_ngoái học lớp tâm_lý so_sánh chương_trình trường_hợp đẻ học_sinh lớp hiếm đa_số phụ_huynh chương_trình,0
2247,mong cháu vui_khỏe khổ_ải trần_gian,0
2248,dự_trữ tài sảng số_lượng đất chẳng đi mua đất khuyến_cáo mua đất nông_nghiệp trường_hợp bần_cùng kinh_tế trang_trại chờ đông sơn tái_khởi mua đất khuyến_cáo thổi_phồng,0
2249,thu_nhập d trump,0
2250,hoa_hậu đại giangười chân ngắn vợ,0
2251,cầu ngọc hồi mễ sở hà_nội công tỷ tận tỷ,0
2252,hỏng kiểm nồng_độ đi lạc nguy_hiểm_quạ chúc_mừng,0
2253,phát thải khí nhà_kính tương_lai,0
2254,cầu_mong suy_yếu dịch_bệnh kinh_tế suy_yếu lắm bão nổi,0
2255,đọc trúc nhi diệu nhi vui mong mau xuất_viện yêu,0
2256,tuyệt_vời chúc khoẻ_mạnh,0
2257,chia chia mua tuỳ đừng dồn trứng giỏ chu_kỳ máu bảo đừng mua lỡ giá khả_năng thánh đoán chính_xác,0
2258,thông_tin chạy đọc hồi_phục khỏe mừng lắm y bs đồng_hành suốt yêu,0
2259,tuyệt đẹp sinh sức tấn_công kinh_khủng,0
2260,kiện_tụng mấy bữa ông_già đi cules tâm toàn_thể fan đội la liga đội từ_chức ủng_hộ,0
2261,có_lẽ trầm_cảm mùa đông hichic tâm_trạng chán ghê lang_thang biển phen ',0
2262,băng tan,0
2263,tập_thể_dục sức_khỏe đừng mất_mạng,0
2264,học phờ phạt chương_trình cực_kỳ xưa đọc viết,1
2265,lái lái_xe lấn làn tuân_thủ tín_hiệu đèn,0
2266,cameron diaz quyến_rũ phim the mask hút_hồn,0
2267,đề_nghị pháp_luật tước quyền cha_mẹ đi tù mọt_gông giao bé trung_tâm bảo_trợ xã_hội nuôi ăn_học bạo_hành đọc đau_lòng bố_mẹ bé sống tuổi_thơ,0
2268,tội tội tội_ác hiếp_dâm trẻ_em tội ghê_tởm trừng_phạt thích_đáng,1
2269,khai niệm hàng trung_quốc,1
2270,kỹ_năng may thoát hiểm,0
2271,chúc_mừng fan,0
2272,kết_quả đoán,0
2273,biden tranh_cãi,0
2274,tôn_trọng chúc thành_công đối_thủ,0
2275,năm_tuổi mèo gắn chip nghi hậu_duệ mèo xưa,0
2276,kẽ hở vay vốn toàn đi lối tắt hậu_quả,0
2277,gọi cụ cá xấu cụ sống phiền_lòng tình cụ đẻ trứng thụ_tinh đi cụ đời,0
2278,cháu vợ tranh_thủ tắm nấu_ăn nhà_ăn thịt kho đen cá kho đen mấy hài chả ngon_lành dám chê dối tấm_tắc ngon,1
2279,liverpol đội_hình toàn thua chủ_quan arsenal ngược_lại arsenal kiên_cường cộng may_mắn,0
2280,tổng chết,0
2281,altis giá đi ổn hỏng,0
2282,hai mặt bất_nhân,1
2283,chị_em sắm làn cói mây gia_đình phân_loại giải_quyết lắm,0
2284,chúc mãi_mãi bình an mau chóng con_trai,0
2285,đá vui thay huấn_luyện_viên,0
2286,bale tottenham mbk thống_lĩnh giải ngoại_hạng,0
2287,ấn độ peru trung_quốc,0
2288,ố pen kìa,0
2289,phương_tiện tương_lai,0
2290,tội,0
2291,chấp_hành tuyệt_đối đeo khẩu_trang ta vỡ trận đợt bay quốc_tế bệnh lây ta,0
2292,kết_hợp chạy dịch_vụ tiết_kiệm hiệu_năng chạy lo_ngại sửa_chữa đắt fadil tổng_thế toàn chắp_vá xe khung vỏ động_cơ vins sảng xuất hỏng,0
2293,cứu_chữa bệnh tịch_thu sảng phẩm nguyên_nhân xét_nghiệm độc_tố sảng phẩm lỗi khắc_phục sự_cố tâm thắng cố,0
2294,kinh_khủng cầu_mong bình_an,0
2295,chúc_mừng arsenal liv cố_gắng epl đi_sâu lồn mãi yêu liv si,0
2296,tổ_quốc đẹp,0
2297,mèo đa_số kiểng lười nhớt thây chuột cỡ chui vô chăn trốn nuôi linh_miêu chó_săn cú đại_bàng loài mê thịt chuột hy_vọng tiêu_diệt,0
2298,covid chẳng nể tổng_thống đeo khẩu_trang nhiễm mỹ bao thế_giới mong gia_đình chóng điều_hành đất_nước,0
2299,đẹp đi chồng tiếc,0
2300,hit vô_khối giai_đoạn siêu hot đi chân lẻ_loi phiêu du một_mình tình gót hôn môi tình mưa bóng_dáng thiên_thần kiếp rong buồn đợi_chờ phố xưa email tình_yêu biệt khúc chờ chờ song_ca cẩm ly đừng quên dòng máu lạc hồng giai_đoạn dòng sông băng tình_khúc vàng đêm tình_yêu lỡ hẹn giai_đoạn mãi_mãi tình_yêu đổi_ngôi nắng sân trường chim trắng mồ_côi giai_đoạn sóng yêu_thương trăng vỡ nội đợi_chờ giai_đoạn thiên_sứ tình_yêu hát_ru tình_yêu cắn môi tình đau xin_lỗi ngôi_sao bay ước_mơ ngọt_ngào liên khúc ngườivề phong_độ vớt yêu biển nhân_gian ca_khúc dân_ca ba_khía ngốc lắmcá nhân chân lẻ_loi phiêu du hôn môi ca_khúc đẹp,0
2301,thân kiểu hix,1
2302,cạn_lời mẹ con_người,1
2303,người_ta giỏi công_nhận công_việc chuyên_môn tìm_tòi chê_bai hạ khả_năng,1
2304,cảm_giác sung_sướng fadil mua xe ô_tô đi camry le xạo fadil phê,0
2305,bản_chất con_người đừng đổ lỗi bia rượu côn_đồ nhậu hung_hăng,0
2306,há miệng chờ sung,0
2307,chúc mau_chóng hồi_phục_sức_khoẻ bé hulk,0
2308,ảnh bìa d,0
2309,bieu hiện bệnh alzheimer,0
2310,bất_cập thí_sinh nguyện_vọng trường chẳng_hạn trường đậu thí_sinh đợi xét tuyển bổ_sung trường top,0
2311,sân_chơi minamino tiếc pha lỡ,0
2312,triệu chục triệu mua xe dòng hạng nhật nisan suny vios lành,0
2313,bám real real sấp_mặt bale bám hôi cup cup bám đỏ nổi tuyển hò_hét đường_biên eder ném cup rơi vỡ đầu,0
2314,biden ý_thức phòng_bệnh,0
2315,chiếu rạp,0
2316,công_bố giá vé dự_kiến_vậy,0
2317,combo iv xịn,0
2318,đua tomy said,0
2319,cây_xanh chắn bão cưa đi chắn bão,0
2320,trận thua đội quân thua đấm thẳng mặt đấm không_khí quân đá thẳng top,0
2321,tuổi_trẻ thể_hiện máu yên hùng thua hơi men nguy_hại họa tàn cuộc_đời,1
2322,đánh nuôi bảo_vệ trẻ_em già trường_hợp đánh thương_tật hậu_quả nặng_nề hic,0
2323,mẹ thương quê mẹ miền trung,0
2324,mấy mua xe nhật rành mấy món lắm mua xe đi lắp phụ_kiện bánh_xe ghế chẳng,0
2325,hy_vọng bão vàng giải_khát miền trung trung bổ_sung sông mekong lũ hoàn_lưu bão nằm khu_vực bắc lào bắc thái lan bổ_sung sông mekong,0
2326,tàn_khốc rõ_ràng răn_đe_mạnh,0
2327,si qbv wcup qbv rô,0
2328,đi tích lịch_sử quý_giá gắn liền chiến_tranh du_kích tạo_dựng mô_hình tỉ_lệ thế_hệ hình_dung gia_đình gìn_giữ tôn_tạo di_tích,0
2329,máy vứt đi seltos mã lắp máy kona ngon,0
2330,kiểm_soát chặt_chẽ vùng_biên_giới đường_bộ covid khả_năng thời_tiết trở lạnh chủ_quan,0
2331,mèo đánh khéo vả chết ngất to to mấy chồn ghét lắm,0
2332,huấn_luyện_viên vị bố_trí toàn giẫm chân coutinho ăn_ý chào vọng griezman guống baxa công ổn chờ thủ,0
2333,khoảnh_khắc ước tham_gia kỹ niệm đẹp,0
2334,xe chấp_nhận xe lướt acent cerato elantra hạng rộng êm cách_âm tùy_gia chủ,0
2335,tin_vui,0
2336,đường_dây_nóng tố_giác báo_cáo dân nghi_ngờ chăn_dắt trẻ ăn_xin,0
2337,ảnh tưởng_tượng hình chẳng,0
2338,mua san hợp trend độ sướng đi sa sướng sa suv thực_thụ san,0
2339,đơn_giản tam_giác nằm hệ qui chiếu trái_đất đứng trái_đất quan_sát tam_giác trăm ánh_sáng tam_giác hạt cát diện_tích thái_dương hệ,0
2340,trời khóc,0
2341,quyết_định to_vậy trồng,0
2342,nhà_hàng cung_cấp nguồn_gốc thịt chó phạt phạt trăm triệu xanh_mắt,0
2343,trời đọc nổi da_gà,0
2344,giáo_dục môn bơi_lội bắt_buộc trường_học khóa bơi cơ_bản học trung_tâm trường tiểu_học kêu_gọi đóng_góp học_sinh mua xây bể_bơi chương_trình kĩ_năng sống học suông học_sinh nhắc chào hiệu_quả chết_đuối thương_tâm mong bộ_môn bơi_lội giảng_dạy,0
2345,giúp hậu_quả cảnh_tỉnh cơ_quan_chức_năng đại_lý phân_phối cộng_đồng chế_tài hình_sự hành_vi vi_phạm an_toàn thực_phẩm hậu_quả vô_cùng nặng_nề buông_lỏng ví_dụ điển_hình quầy bày bánh trung_thu dựng lều bạt đường trời nắng_nóng liệu an_toàn,0
2346,angie ích_kỷ giành nuôi công_bằng brad hy_vọng thắng kiện nuôi chia đôi nuôi hợp_lý,0
2347,oh thầy khánh vy,0
2348,tiền_đạo sắc_bén barca mẹ đọc nhầm,0
2349,cuộc_sống sự_kiện đôi_khi người_ta hề mong_muốn chúc ngài tổng_thống bình_phục,0
2350,mong cuộc_sống tốt_đẹp,0
2351,chặt vây_cánh si tăng_cường hàng thủ cố chất hà_lan hy_vọng thành_công,0
2352,có_lẽ mua đông khắc_nghiệt toàn thế_giới phòng_bệnh,0
2353,nổi_tiếng đẹp_trai tiền gái,0
2354,giả_sử tồn_tại tam_giác diên tích công_thức chiều nhân độ đáy chiều suy độ đáy suy góc đối_diện suy góc kia suy cạnh đối_diện góc bé đường_cao vẽ góc bé cạnh bé đối_diện tui mấy vẽ thử,0
2355,bắt_gặp thú_vị ' ',0
2356,kiếp rong buồn mùa đông tàn phai hồi đi du_học đám tụ_tập uống bia đệm đàn anh_em hát kiếp rong buồn mãi,0
2357,đi vios ngon bổ rẻ atrage,0
2358,ái_mộ diễn_viên,0
2359,huyền_thoại thể_dục dụng_cụ tương_lai trung quốc quốc_gia vốn hàng_đầu thế_giới môn,0
2360,dính bay quốc_tế nản,1
2361,hiền lắm cắn nhiw kiểu cắn phép chủ,0
2362,công_dân mỹ sẻ bầu trump trẻ kinh nhiệm_kì,0
2363,lam bàn gi,0
2364,cơ_thể,0
2365,mê bim thận to tổ chảng hẳn cân_đối đẹp,1
2366,ác quỷ đừng coi nghiện bệnh_nhân dính ma_túy mua_bán tội_phạm,1
2367,đơn_giản đem niềm vui bé sarah,0
2368,hẹn vm phương d,0
2369,mong khoa_học phát_triển nhanh_chóng nhân_loại khổ_đau cám_ơn đội_ngũ y_tế chúc nhà_may_mắn thắng,0
2370,pháp_luật xử thẳng_tay làm_gương,0
2371,phạt tước lái trường_hợp,0
2372,nghi_ngờ xấu cứu tính_mạng sai_sót,0
2373,mua đất muộn,0
2374,đông thành_tích kỷ_niệm,0
2375,phim giải liên_hoan_phim busan cục điện_ảnh định cấm công_chiếu nôi,0
2376,lốc xoáy mắt lạ_mắt,0
2377,kiếp ve_sầu đi tình gót nắng sân trường tình mưa mãi_mãi tình_yêu mưa buồn ảo_mộng tình_yêu chờ hôn môi mưa tình,0
2378,cho_dù mesi xứng_đáng barca tạc tượng chúc tốt_lành fan,0
2379,mất_mát lớn_lao gia_đình lãng xẹt,1
2380,bơi ao mãi biển sóng đánh vỡ mặt achen minh_chứng,1
2381,tuyệt_vời việt nam mong kéo_dài mãi,0
2382,phim khoa_học viễn_tưởng thành hiện_thực tương_lai,0
2383,sợ khuôn_mặt,0
2384,vios thua_thiệt mặt biệt_danh thùng tôn,0
2385,bố vĩ_đại,0
2386,sevila thắng loạt đá luân_lưu,0
2387,bão nuol chuyển_hướng cấp_độ,0
2388,giấy_tờ tùy_thân hồ_sơ đi,0
2389,đứa trẻ bất_hạnh,1
2390,chân_thành bác_sĩ nguyễn trung_cấp toàn_thể tham_gia chống dịch bình_yên xã_hội,0
2391,tái_nhiệm nguyên_cớ hợp_lý tự_trọng ngài trump,0
2392,cuồng xe hàn quốc công_tâm xe hàn_quốc thời_trang đi xu_hướng thời_đại sảng phẩm nhẹ_nhàng thanh_thoát mượt chất_lượng tầm thua_kém xe nhật nhật cường_quốc lĩnh_vực thế_giới thị_trường việt nam đna lĩnh_vực ô_tô đặc phân_biệt đối_xử nặng_nề thế_giới sản_xuất thùng tôn di_động kém chất_lượng dấu cụchủ nhậtmáy cn thập_niên tinh_chỉnh một_chút thiết_kế thập_niên lắp_ráp hàng_loạt giá thánh cuồng khẩu_hiệu tiết_kiệm nhiên_liệu bền tiêu_dùng phát_hiện chủ_nhật cn bền sót dăm_ba thánh cuồng thùng tôn tưởng đỉnh cachủ nhậtcủa cn xe_hơi khách_quan tầm hiểu_biết xe hàn âu mỹ việt hchủ nhật cn thiết_kế độ an_toàn gấp mớ thùng tôn hỗn_độn xấu_xí kia chê âu mỹ chê thùng tôn việt_nam,0
2393,dunlop cao_su bánh_xe gọi lốp xe,0
2394,tuyệt_vời việt nam cố đất_nước chiến_thắng,0
2395,cầu trời ngài gia_đình bệnh_dịch bình_phục phong_cách suy_nghĩ hành_động ngài,0
2396,trời mua toyota wigo cũ lướt sàn bền đừng mua mon hỏng vặt đời trật chội lắm,0
2397,xe cũ hỏng vặt mua xe đi nisan suny hạ giá kịch sàn đấy dáng đẹp xe ngon vạn xe cũ mua xe cũ múc vios taxi hoàn_lương chết_dở,0
2398,cháu bố_mẹ lý_lịch bố lẫn mẹ phức_tạp mong hai nội ngoại cố_gắng nuôi cháu cháu trưởng_thành cháu nhận_thức xấu bảo_vệ chín thương lắm mong sức_khỏe,0
2399,bão đi tây nam vùng_biển sâu ấm cầu_mong bình an mảnh đất miền trung,0
2400,cổ_động_viên xịn nước_ngoài coment kiểu hâm_mộ nửa_mùa mấy,0
2401,đừng kiến_thức trẻ đầu người_lớn phức_tạp đọc chữ,0
2402,covid chính_quyền trump pháp vỡ trận thành_quả nhiệm_kỳ trump chối_bỏ,0
2403,mở_cửa kiểm_soát dịch cách_ly tiền ảnh_hưởng kinh_tế hô_hào mở_cửa kiếm tiền công_việc ảnh_hưởng sống dịch phát_triển kinh_tế,0
2404,khí_chất chấn_thương golf,0
2405,uống ngon,0
2406,đau_lòng,0
2407,vui nhen_nhóm ý_định mua bhnt khuyên mua tiền thời_gian_tham_gia_bảo_hiểm tài_khoản trẻ tài_khoản lớn_tuổi cạnh bệnh_tật tai_nạn phòng_tránh mua,0
2408,tổng_thống dám dám trump mỹ giàu_mạnh trở_lại,0
2409,người_ta người_ta mua,0
2410,nam_mô di_đà phật sinh_vật tánh_linh,0
2411,hình_thức phạt xứng_đáng kẻ ma_túy,0
2412,kỹ_thuật nhân_lực đừng cổng tập_đoàn cổng đề biển cạnh an_toàn thi_công hiện_đại tiện check in,1
2413,chúc mạnh_khỏe giúp_đỡ bé thương ',0
2414,hóng bình_luận kia,0
2415,thông_minh kỷ_luật ra_phết,0
2416,đi bạn_đời đấy cấm_đoán khổ nguy_hiểm tây lắm_chuyện tưởng tuốt bảo_thủ,1
2417,cules sướng âm_ỉ bất_chấp thần_tượng biến thành quân cờ kẻ nè hi_hi,0
2418,thằn_lằn táng vịt đẹp mấy kia bình_thường,0
2419,căn_bệnh gọi bệnh,0
2420,dàn máy_tính render ùi,0
2421,độc_ác,1
2422,công_bằng kỷ chữ xài gòn lô gô phông_chữ kiểu in lồn,0
2423,nhẹ cô_giáo mong học_sinh học nuốt trôi sách,0
2424,fast fod việt nam thành slow fod chờ chiên gà kinh_khủng,0
2425,bào_ngư,0
2426,duy_trì áp_thuế dịch_chuyển chính_sách thuế ngấm dịch_chuyển chắn chắn lâu_dài chuyển_dịch cư cấu sảng xuất,0
2427,rùng_mình,0
2428,con_người hủy_hoại trái_đất buồn,0
2429,hài_hước,0
2430,tâm bố soi vĩ_đại,0
2431,cờ tranh_cử,0
2432,xe quất chồng đổi xe quyêt vay_mượn đổi xe xe cũ đi hỏng hỏng kia đi thoải_mái lắm giá tiền,0
2433,mua soluto hư_hỏng sửa_chữa thay_thế rẻ mit hơi khoản,0
2434,hài toàn giáo_viên dạy cháu đọc viết đỡ trường cháu học hai mệt chả cháu học chủ_nhật nghỉ,0
2435,đời,0
2436,pha kiến_tạo roberto cules kiến_tạo băng,0
2437,ngược trường cấm tóc mấy toàn đầu táng,0
2438,ấn độ có_nhân_công giá rẻ trình_độ ngành công_nghiệp phụ hẳn công_ty ấn độ tiên,0
2439,vè kiến kiến_lửa tập_đoàn kiến_vàng ổ đầu cổ thiệt kiến hùm động_trời sôi kiến_cánh_kiến_lửa bò ngang bò ngửa kiến riện đơn chai bò dông bò bò bò kiến đực kiến khôn,0
2440,cầu_mong thế_giới bình_an,0
2441,số_lượng kiểm_tra văn toán môn hầu_như_không,0
2442,chúc_mừng gia_đình,0
2443,nam_nữ nghệ_sĩ tone kiều bắt hương tràm dương hoàng_yến hoài lâm hát live thể_hiện tốt_giọng hát toát nội_dung hát chào vọng hl sóng_gió trở_lại hâm_mộ phút ban_đầu ca_khúc đi hát karaoke chúc hl sức_khoẻ vững_tâm thả hồn,0
2444,cha_mẹ coi cục vàng nuông_chiều sẵn_sàng ăn_hiếp động ầm_ĩ,1
2445,bảo_vệ loài vật nguy_cấp hiệu_quả_thật qui_mô,0
2446,đường_cong đẹp tội mặt,1
2447,chúc_mừng trở_lại cuộc_đời vui,0
2448,ta tái_diễn đánh_đập chức_trách xã vụ_việc thẩm_quyền báo_công_an huyện hài,0
