Unnamed: 0,Free_text,Label_id
1355,cầm_thú cách_ly vĩnh_viễn,1
1356,vô lớp tinh_thần mắng vốn viết chậm đọc chậm học dở kệ giáo_viên lớp gấp_gáp lớp bắt học cắm_đầu cắm_cổ vui_chơi sáng_tạo,0
1357,đối_thủ đi khám,0
1358,mong ngài chúa ngài,0
1359,mấy đạp xe tập_thể_dục sức_khỏe bền_bỉ làm_ơn đừng đèn_đỏ mấy đạp xe dừng đèn_đỏ khu lách đi thẳng quyền chán mấy đấy,1
1360,bản_chất krist xấu sẵn tội_phạm,1
1361,đi fadil nội_thất chật_chội máy dựng tìm_kiếm linh_kiện thay_thế tầm tài_chính chăm xe ngành có_lẽ ổn,0
1362,alibaba hệ sinh_thái hàng grab đảm_nhiệm đi giao,0
1363,xe mấy dân đi chán tự_tin xấu múc,0
1364,sưu_tập phim kinh_vậy phim khoa_học viễn_tưởng đội bang mùa covid ha_ha,0
1365,trump dương_tính covid đua thú_vị,0
1366,đu sợi dây học phòng cháy chữa_cháy xong xung_phong demo liền đơn_giản trẻ khỏe lớn_tuổi thua thang dây đu dây tuột toang chung_cư toàn cao_tầng khớp,0
1367,bay ưa_chuộng nổi kinh_hoàng tiếp_viên thiết_kế thân_thiện tiếp_viên chỗ nghỉ chỗ ngủ chật_hẹp đường_bay đa_số,0
1368,thương_tâm cha_mẹ bé bé đi tắm ao,0
1369,giải nobel hòa bình trump,0
1370,chúc ngài hồng kông phu_nhân nhanh_khỏe ủng_hộ đắc_cử nhiệm_kỳ,0
1371,cử hilary dồn đường lật_ngược cờ thắng áp_đảo mong chóng bình_phục lật_ngược tình_thế,0
1372,vòng chung_kết công_nhận tài_năng giành vòng nguyệt_quế niềm tự_hào gia_đình trường học dân địa_phương,0
1373,chúc_mừng_công_an hà_tĩnh bọn liều ghê,0
1374,nga nhập_cảnh chuyên_gia ấn độ nhiễm covid may cách_ly mong việt nam áp_dụng cách_ly tối_thiểu nâng cao_độ an_toàn mở_cửa,0
1375,đừng mu_vago huấn_luyện_viên tồi,0
1376,phố thoát hiểm bình chữa_cháy thang dây đề_phòng,0
1377,văn_minh hại,0
1378,diệu_kỳ tuyệt_vời,0
1379,công_nghệ lắp_ráp tình_cảm khuấy_đảo phân khúc suv nổi_trội san,0
1380,giải_thích chặt_chẽ chào vọng trực_quan chịu_khó vẽ hình tam_giác abc cân cố_định đường_cao chiều x kéo cạnh góc độ đường_cao độ xấp_xỉ tức_là tổng_cả đường_cao xấp_xỉ x kéo cạnh diện_tích tuỳ_ý cạnh_đáy đường_cao cố_định con_số đề_bài bắt đường_cao độ cố_định diện_tích tuỳ_ý,0
1381,santa fe byd đi đường xe điện đi_tắt đón_đầu,0
1382,nhò con_người giỏi tui nín thở lặn sâu mò trai bắt cá định bắt tui,0
1383,fadil chạy êm cách_âm trang_bị an_toàn mua gia_đình fadil chúc mua xe,0
1384,mất_mát nguyên_nhân bé rơi tương_tự,0
1385,đề_nghị gửi thông_báo tận thôn_xóm loa phóng_thanh thôn_bản,0
1386,chuẩn lắm thay_vì ép hoàn_hảo giỏi trường phụ_huynh tôn_trọng mở_rộng ý_tưởng thành_công nuôi dạy hướng,0
1388,mua cam ry đi trời góp xe đi lắm,0
1389,đau_lòng chị_em khóc ròng thương cầm nước_mắt đọc tai_nạn đuối tầm kiểm_soát người_lớn xảy hoài,0
1390,túi_tiền perze mua giải lừa juve cục tạ hazard thành_công real lừa juve tạ đây_vậy,1
1391,đề_cử trump biden giải nobel hòa bình mặt,1
1392,tiềm_năng não trẻ khai_thác khả_năng trẻ khai_thác ảnh_hưởng tiêu_cực tư_duy sức sáng_tạo,0
1393,cụ bảo hổ thịt hai đứa con_cháu đề_nghị điều_tra nghiêm_minh hành_vi nhân_tính đối_tượng bé,1
1394,tam kỳ quảng_nam mở_cửa bật quạt,0
1395,dingo,0
1396,omg,0
1397,giúp ý_thức luyện_tập thể_thao tích_cực chạy hoàn_cảnh chạy thượng_sách chạy sống đừng có_học võ_vẽ giúp_ích,0
1398,gớm chữ_nghĩa diễn_tả ác nhân,1
1399,nghiêm cơ_sở sảng xuất sảng phẩm xem_xét trách_nhiệm cơ_quan trách_nhiệm vệ_sinh an_toàn thực_phẩm nguy_hiểm mùa đại_dịch,0
1400,buồn thay hào thời champions league tranh tài sân_chơi hạng hai milan chức vô_địch bóng,0
1401,trận cầu barca,0
1402,trời tồn_tại cầm_thú hai chị_em nhở đời_thuở ruột em_trai mẹ đi giao_cấu quan_hệ cháu ruột loài cầm_thú hai cháu gái kia sẩy con_mẹ mẹ má mìn tiền hút_chích chơi_bời bắt con_ruột đi ăn_xin kiếm tiền_tiêu tiêu tiền mồ_hôi công_sức tiêu con_ruột thằng đồi_bại khốn_nạn quan_hệ con_ruột yên bọn bản_chất con_người ác_thú cách_ly xã_hội,1
1403,hẳn lý_thuyết vận_dụng kinh_nghiệm nhanh_trí con_người giải_quyết đừng cố tranh_cãi bảo_thủ lý_thuyết,0
1404,ma_tuý lối,0
1405,huế tội_nghiệp,0
1406,diện_tích tam_giác giới_hạn đường_cao vẽ tam_giác_cân chiều mm cạnh_đáy vô_tận diện_tích vô_tận tổng đường_cao,0
1407,đánh cháu bé xấu_hổ truy_tố hình_sự đi ủng_hộ,0
1408,phát_minh vĩ_đại thế_giới người_ta điện_thoại máy_tính,0
1409,tiền_án khoan_hồng nhầm chỗ làm_ơn đi hộ,1
1410,đi đội tiền mua,0
1411,xử khung tội,1
1412,trồng rễ_cọc trồng rễ_chùm bật gốc,0
1413,chừa,0
1414,sedan xấu toyota wigo dáng lục_cục dỡ dỡ ương ương,1
1415,chúc_mừng chiến_sĩ công_an lập chiến_công,0
1416,tài_năng nở kế_hoạch chăm_sóc nuôi_dưỡng khoa_học lãng_phí đất_nước thế_giới chột con_người,0
1417,thịt tươi,0
1418,may cắn ta,0
1419,soluto ổn máy_móc tất_nhiên bốc cvt,0
1420,đi học đau_lòng,0
1421,ghét nuôi chó đảm_bảo_an_toàn xung_quanh,0
1422,đợi phân_hủy phân cá thanh_niên,0
1423,xử_phạt đối_tượng tù buôn_bán g tử_hình tàng_trữ hàng,0
1424,cá_voi sát_thủ thông_minh đứng đầu chuỗi thức_ăn đại_diện muôn loài trả_thù con_người hại,0
1425,võ oánh,0
1426,lionel mesi qbv giày vàng danh hiệucristiano ronaldo qbv giày vàng danh hiệukl lionel mesi cristiano ronaldo,1
1427,chúc cháu vui_khỏe mừng,0
1428,quá_khổ chính_quyền vàng cháu hành_vi dân_sự bạo_hành lẽ_ra cháu chính_quyền công_an thiệp triệt_để thông_báo đầu cháu bớt khổ tội_nghiệp cháu,0
1429,kéo phố đi hai trưng đường điện biên phủ tiếp_giáp_công_viên lê văn tám dân gởi xe xe_đạp xe_đạp điện công_cộng bus điện trung_tâm,0
1430,ráp binz tui trưởng_thành nhận_xét chương_trình tâm,0
1431,bóng real mùa vô_địch laliga barca suy_yếu si cống_hiến nội_bộ lục_đục mùa chủ_quan tăng_cường lực_lượng dự_đoán real trầy_trật top la liga tứ_kết barca si mấy,0
1432,câu lạc_bộ thịnh suy liv mc xây_dựng đế_chế kiểu sir alex thời_buổi kim_tiền mu_đá thói_quen chất quỷ thời hoàng_kim,0
1433,thầy học học phát_âm chuẩn video lưỡng tiện,0
1434,đối_thủ phân khúc đẹp phết,0
1435,chạy sedan phục_vụ gia_đình chủ_yếu chạy chuyến dịch_vụ cảm_nhận phân khúc cốp rộng xăng kiểm_tra bảo_dưỡng định_kỳ cụ câu bền,0
1436,cầu_mong bình an việt nam cố đất_nước chiến_thắng,0
1437,muôn_thuở ý_thức,0
1438,cầm_thú mẹ ruột ruột thú_dữ thịt dạng,1
1439,xấu_hổ phút quyết_định,0
1440,phạt tỷ usd bmw triệu gian_lận khí_thải khai khống doanh_số fan cuồng đức hâm_mộ lắm,0
1441,đúng_đắn ý_nghĩa,0
1442,thế_giới màu cam,0
1443,bale bứt tốc son thay kinh_nghiệm đột_biến trận_đấu,0
1444,câu trả_lời viết,0
1445,tội mong mau sợ tâm_lý,0
1446,săn_bắn sống chan_hoà thiên_nhiên lạnh_giá vẻ buồn tuyệt_vời,0
1447,trung_học phổ_thông trung_học cơ_sở ý_thức hoạch_định kế_hoạch hoàn_thiện kiểm_tra phương_thức kiểm_tra kiểu chuyên_đề cháu học trò tiêu_khiển công_nghệ nghiên_cứu kỹ,0
1448,rối_bời quy_hoạch đô_thị rối_ren quá_khứ xây chữa_cháy quy cũ hiện_đại_để xanh sạch đẹp,0
1449,đội mời euro người_ta danh_tiếng,0
1450,mau giá đất đáy chủng,0
1451,schalke phá kỷ_lục bàn gỡ bàn gở mày đầu munich mày mercedes coment câu bundesliga đi đội tranh vô_địch giải khí_thế ngút trời mùa vô_địch màn ngã pen lê văn nốp đẳng_cấp ngẫm buồn rô gạch đá ngút_ngàn ngã bàn lewandowpen con_số ái_ngại,0
1452,biển phân làn đuòng muổi ô_tô xe_máy đi cám_ơn,0
1453,điện_thoại thông_minh máy_tính công_cụ khoa_học hiện_đại phục_vụ vui_chơi giải_trí học_hành bàn cải khuyến_khích xu_hướng tất_yếu thời_đại ý_kiến điện_thoại học suy_nghĩ xung_quanh hoàn_thiện áp_dụng ap giáo_dục hoàn_chỉnh tích_hợp giới_hạn thông_tin truy_cập lan_man sai mục_đích điện_thoại thông_minh xa_xỉ học_sinh nghèo miền núi_vậy tiếp_cận phương_pháp học_tập đô_thị giáo_viên đào_tạo ứng_dụng câu giáo_dục xây_dựng trả_lời áp_dụng áp_dụng ảnh_hưởng xấu phát_triển cấm giáo_dục tham_khảo áp_dụng,0
1454,mong tiền mua xe học video,0
1455,ăn_chay món chay món chay hình_thù món mặn khoái,0
1456,mắc cười câu công_nhân tay_nghề,0
1457,đọc sợ chém cướp bắt hiếp_dâm phạt chúng_nó lao xã_hội bình_yên chúng_nó ngựa qen đường củ khổ lắm,0
1458,rõ_ràng trump biden cứng_họng biden hướng dư_luận giây_phút hổ_thẹn,0
1459,khốn_nạn,1
1460,khổ dịch_bệnh dứt độc thực_phẩm chúc bình_phục rút kinh_nghiệm lựa_chọn thực_phẩm,0
1461,chúc_mừng giỏi,0
1462,lái xe_bồn vô_ý_thức lái_xe bố_láo đèn_đỏ cố lấn làn xe_máy tai_nạn đi xe_máy xuýt chết oan hung_thần tước vĩnh_viễn phạt đường tai_họa,0
1463,mãi chả già đi tí thời tốn tiền mua băng cát xét album đan trường hit nhạc hoa việt âm_nhạc hoà_quyện tuổi_thơ văng_vẳng đầu tim,0
1464,mua mua muộn phút,0
1465,ca,0
1466,đi xe đức âu hàn quan_niệm xe đức âu hàn đi hưởng_thụ đổi xe sợ mau xuống_cấp hư_hỏng quan_niệm diễn chất_lượng xe đức âu hàn quan_niệm xe xe đức âu hàn lo_lắng u_sầu mua xe cũ đức âu hàn mercedes xe đa_số đi xe đức âu mong_muốn đi đi hà_cớ thay chủ hầu_hạ triệu tiền kia thông_minh triệu tốn công_sức tiền_bạc hầu_hạ xung_quanh đi xe đức âu mẹ bỉm sữa xe đức âu thân,0
1467,thương lắm khúc ruột miền trung,0
1468,vất_vả cuộc_sống mưu_sinh,0
1469,ngành ngành y_học cộng thực_hành bệnh_viện chứng_nhận chứng_chỉ tiền chuyên_môn hành_nghề,0
1470,mỹ bình_thường khả_năng ngôn_ngữ tiếng mẹ_đẻ khâm_phục đam_mê ngôn_ngữ tiếng thước_đo giáo_dục kỹ_năng tổng_thể thành_công đừng ép ngoại_ngữ,0
1471,hợp_tác lớp thu tiền đào_tạo thu trường đĩ y_tế hà_tĩnh sai học_viên,0
1472,cầm_thú,1
1473,cảnh_tỉnh cơ_sở sảng xuất nằm len_lỏi dân_cư đô_thị quy_định máy_tính cơ_sở trách_nhiệm quản_lý trật_tự may thiệt_hại bài_học chào vọng tương_lai tươi_sáng,0
1474,tài_tử điện_ảnh_vậy,0
1475,sơn tùng bất_hiếu bớt sân si đi bale đội bóng cũ niềm vui_chơi bóng,0
1476,áp_dụng hình_phạt sửa độ trách_nhiệm hình_sự hành_vi côn_đồ dã_man nguy_hiểm xã_hội cộng_đồng,0
1477,cụ năm_ngoái giúp tình đẻ lô chục trứng khiếp trời_đất mãn_nguyện xd,0
1478,đau_xót học năm_học mong yên_nghỉ,0
1479,ma_túy con_người ma,1
1480,venezuela miền đất sinh hoa_hậu tuyệt_vời,0
1481,trời đi vững bơi cha_mẹ bận kiếm miếng cơm manh áo chăm_sóc tội_nghiệp thiết_nghĩ thành_phố nông_thôn nghèo giàu con_cái tài sảng để_mắt kiếm miếng cơm tập kỹ_năng mong bình_an,0
1482,phim vợ_chồng chẳng toàn diễn,1
1483,chả tài đấy cuộc_sống viên mãn,1
1484,vi rút covid khủng_khiếp,0
1485,bánh hấp_dẫn mấy tràn_lan đường,0
1486,di_chuyển trung_tâm thành_phố bất_tiện phương_tiện công_cộng tàu_điện_ngầm phát_triển,0
1487,biệt_thự móng vị đại_gia chi quan_sát ta trày da tai_nạn tội mua_bán trái_phép_hóa đơn,0
1488,nước_ngoài ủng_hộ nhà_trường độ thiếu_niên học tự_do thể_hiện bằng_vẻ bề_ngoài trường_học đông thiếu_niên độ thể_hiện nhà_trường quản_lý hướng mục_tiêu học_tập,0
1489,bảng xếp_hạng xe_tải hyundai porter đứng,0
1490,hồi trẻ tuyến đường tuyến đi,0
1491,cũ chi_phí đổ đầu xăng giá vé bến vé tóm thiệt_thòi dân đi thiệt,0
1492,chính_quyền cấm trẻ_em đi ăn_xin vé_số vậy_vậy phát_hiện vô làng trẻ sos kẻ nhân_tính lợi_dụng trẻ_em công_cụ kiếm tiền hình_ảnh đứa trẻ đi ăn_xin thương chính_quyền cứu_giúp trẻ tạo_hình_ảnh tốt_đẹp viet nam mắt nước_ngoài bảo_vệ trẻ_em thiết_thực,1
1493,mua lắp lắp bằng_thừa,0
1494,cầm giày nói_chuyện,0
1495,xe gia_đình đi du_lịch chevrolet cruze lựa_chọn xe đi đầm đi phố hơi hao xăng phân khúc độ an_toàn bao lái thử xe cảm_nhận quyết đầu phe hàn nhật tư_vấn,0
1496,tưởng cuộc_đời tù đi tù hix tài đấy tội,0
1497,tối gia_đình học đánh_vật lớp nổi học bài_vở phát sách học tập tô tập viết stres cải_cách giáo_dục kiểu,1
1498,đi học đi showbiz cầu_thủ đá banh tui ủng_hộ hớt_tóc kiểu bờm ngựa cầu_thủ nước_ngoài dạy nghiêm_chỉnh chỉnh chu sống kỷ_luật bé may_rủi đứa tự_do cá_tính xăm trổ sống buông_thả thành ngổ_ngáo vướng vòng pháp_luật,1
1499,tự_hào,0
1500,ác quỷ con_người,1
1501,tội_nghiệp di_đà phật môn bơi_lội dạy học_sinh mẫu_giáo lớp nổi cơ_thể,0
1502,thần_tượng chúc hạnh_phúc,0
1503,vàng gởi tiền ngân_hàng tầm mua đất,0
1504,mẹ đẹp bảo con_trai đẹp mẹ trẻ đẹp chị_gái,0
1505,tự_do nhâm_nhi cafe ý_nghĩa công_sức đội_ngũ y bs cám_ơn,0
1506,thương mong trẻ cân_nhắc kỹ hành_động trẻ_em bỏ_rơi xót_xa,0
1507,toàn gương_mặt trẻ chúc mạnh_khỏe thành_công lĩnh_vực,0
1508,bánh trung_thu bánh_dẻo kích_cỡ nhỏ_to hình_dáng truyền_thống nghìn truyền_thống truyền thừa thế_hệ thế_hệ thế_hệ đột_ngột đổi_mới hình_dáng gọi bánh hình heo nhím dâu_tây màu tím vàng xanh đỏ ánh bánh trung_thu xin_lỗi lịch_sử văn_hóa nguy_hiểm tết trung_thu bánh trung_thu trở_nên xa_lạ bố mẹ đứa con_cháu bánh hình động_vật hoa_lá bánh khuôn truyền_thống đứa trẻ vô_tư trả_lời hình động_vật hoa_lá màu_sắc kia bánh trung_thu thế_hệ nghìn,0
1509,quy_định rõ_ràng phương_tiện thô_sơ chạy làn xe_máy chạy làn xe_hơi làn làn lách làn đoàn tách chứng_kiến đi xe_đạp húc văng đèn bảo nhường đoàn đua,0
1510,đồng huấn_luyện_viên trưởng trò_đùa quyết_định lạ_lùng vleague từ_chối quyết_định bầu đức vòng lẩn quẩn gđkt huấn_luyện_viên kiểu xoay tròn đội bóng lo trụ hạng,0
1511,tuyệt_vời chúc_mừng bệnh_nhân đội_ngũ y bác_sỹ,0
1512,nổi tồn_tại mẹ đánh_đập hành_hạ con_ruột xoá vết_thương thân_thể vết_thương tâm_hồn,1
1513,tiếng việt tinh_giản thời_lượng kéo_dài tiết mặt khoa_học học_sinh hề học tinh_giản tinh_giản thời_lượng tiết nội_dung thi,0
1514,bale toả bale may_mắn thể_chất chấn_thương tầm ro si hiện neymar bale khoẻ_mạnh toả trận neymar kĩ_thuật ăn_đứt tất_nhiên tầm hazard chúc bale khoẻ_mạnh mùa bale đóng_góp to_lớn real,0
1515,mua xe đi đương_nhiên fadil xe hậu_mãi dịch_vụ hãng chuyên_nghiệp giá rẻ mặc_dù chạy khen fadil,0
1516,hổ thịt nỡ,0
1517,tiêu_thụ xăng dựa yếu_tố dung_tích xi_lanh hộp_số khối_lượng xe kỹ_thuật lái_xe nhầm_lẫn hao_mòn hư_hỏng đa_số xe chất_lượng xe hư_hỏng sự_cố,0
1518,cháu chúc bôm vui sống an yên may_mắn cháu đọc bôm cuộc_đời tươi_sáng,0
1519,độc nhập_viện y_tế khuyến_cáo mấy thánh đọc kỹ,0
1520,atp tuyệt_vời luật luật cố tay_vợt nole thành_lập ptpa đấy lắm atp,0
1521,thả tự_nhiên,0
1522,sancho câu lạc_bộ xây_dựng vô_địch sir alex nghỉ câu lạc_bộ đổ tiền xây_dựng cầu_thủ huấn_luyện_viên đắp chăn che đầu hở chân che chân hở đầu tiến_bộ luẩn_quẩn lối hàng công hàng thủ dắp chỗ hổng chỗ kia pep klop huấn_luyện_viên tài_ba thế_giới bộ_óc sáng_tạo chiến_thuật xây_dựng lối đứng đỉnh châu âu klop liv vị_thế câu lạc_bộ tài_chính đội_hình thu_hẹp ngự_trị top dấu_hiệu đi klop dặm chừng sol huấn_luyện_viên kinh_nghiệm tài_năng nhân_tố con_người sẵn dấu_ấn,1
1523,covid mua giá rẻ hoei khí nhất_định_giá bds,0
1524,tội_nghiệp mấy bé người_lớn ốm_đau nằm viện người_thân cạnh mồ_côi thiệt_thòi cố_gắng sống,0
1525,công_chúa nhạc pop đỉnh_cao,0
1526,xe việt_nam đắt đường_xá kém,1
1527,kẻ vô_ý_thức tội_nghiệp táng bé,0
1528,hoan_hô chúc sức_khỏe_nhiết huyết tận_tâm tiêu_diệt lũ ma_quỷ xã_hội bình_yên nhà_nhà yên_ấm tươi_vui,0
1529,mong đừng khí_chất golfer real spurs mừng,0
1530,vàng đi mua khoản suy_nghĩ hơi thiệt,0
1531,tuyệt,0
1532,phòng_chống dịch quyết_liệt việt nam thế_giới tự_hào việt nam,0
1533,xét_nghiệm chủ_nhật âm_tính yên_tâm trump bữa nhiễm lây thứ_sáu âm_tính,0
1534,án đi hợp tình hợp_lí,0
1535,penunited sút pen ghi_bàn lập kỷ_lục hè,0
1536,ấn độ cổ_hủ phân_biệt giai_cấp xứng vị_thế cường_quốc,0
1537,ích cám_ơn,0
1538,quên,0
1539,hy_vọng niềm chúc thế_giới an_lành,0
1540,tự_hào chúc_mừng,0
1541,mừng cộng_đồng đông xét_nghiệm cảnh_giác,0
1542,chúc bé hồi_phục_sức_khoẻ trở_lại trường ước_mơ cuộc_đời chúc cháu khỏe thành_công cuộc_sống,0
1543,hô_hào đóng_cửa phòng_dịch đi học đi xứ mắc_kẹt xứ mở_cửa mở_toang tức_là chuyên_gia lao_động nước_ngoài công_dân việt_nam nước_ngoài hạn cần_thiết ai_bảo mở_toang du_lịch quốc_tế phản_đối ầm_ầm,0
1544,đóng thuế thu_nhập khủng doanh_nghiệp phạm_pháp đối_mặt án tù hề đơn_giản đóng thuế thuế quyền nghĩa_vụ công_dân đóng thu_nhập nghĩa_vụ,0
1545,cuba xứng_đáng cống_hiến,0
1546,buông_thả sống,0
1547,phạt hình_phạt đau_đớn thể_xác nhớ_đời ngồi_tù,0
1548,vợ_chồng mặt tiền_đường thành xây dần kiot thuê tự_nhiên đòi mua đất đà_nẵng,0
1549,biden phúc_hậu trump,0
1550,đau_lòng thương,0
1551,đứa gia_đình người_lớn trông trẻ_con trông,0
1552,đeo khẩu_trang hở mũi,1
1553,máy tô tự_động máy nước_ngọt tự_động giàu uy_tín,0
1554,đội bóng italia tăng_cường huấn_luyện_viên cầu_thủ cạnh_tranh cực_kỳ laliga quanh đi quẩn đội thực_lực tranh_chấp chức vô_địch,0
1555,ghê_vậy bình_luận,0
1556,công_nghiệp giải_trí hàn_quốc áp_lực lắm cường_độ công_việc kèm bê_bối tình_dục,0
1557,chúc_mừng hài rap việt wowy,0
1558,thi_đấu niềm vui bóng_đá nghệ_thuật tinh_tế đẳng_cấp thống danh_hiệu,0
1559,máu côn_đồ phút lầm_lỡ đời ngồi_tù,1
1560,đoạn jen già quá_xá,1
1561,xăng giá hàng_hóa xăng giá_cả đứng yên xăng giá_cả hạn_chế điều_chỉnh giá xăng,0
1562,tỷ tỷ mua bất_động sảng nhà_đất tỷ suy_nghĩ đầu_tư lãi_suất ngắn kinh_doanh đầu_tư cổ_phiếu tiên mã ngân_hàng công_ty công_nghệ mua bất_động_sản mua khu_vực giáp long an kinh_tế khu_vực miền tây dự_án cao_tốc hướng khu_vực miền tây,0
1563,uefa phép khán_giả sân puskas budapest đức tây ban d,0
1564,nghỉ học đình_chỉ mấy học_sinh nghỉ biện_pháp lao_động công_ích trường dọn vệ_sinh dọn vệ_sinh trường có_nhân_viên vệ_sinh giám_sát hướng_dẫn,0
1565,mẹ nội ngoại mẹ ớn món lắm,0
1566,di_đà phật,0
1567,xấu hình_ảnh đạp xe tuân_thủ luật giao_thông,0
1568,câu mua,0
1569,thương tường đổ chết học_sinh,0
1570,xe mỹ hồn hàn đừng mua chả nhận_xét xe ngon xe mất_giá thị_trường,1
1571,atrage đi at khoản biển tỉnh chạy kiểu_dáng đẹp hàng nhập thailand mua vios mt,0
1572,ấn_tượng hồ tình xuyên,0
1573,ca_khúc tủ học trung_học dòng sông băng mãi_mãi tình_yêu ca_khúc đan trường đôi mắt đi hồng tặng mẹ trăng vỡ thời thanh_xuân nhạc bo thần_tượng,0
1574,trẻ_em búp cành,0
1575,thương_trường chỗ giấu kín mức_độ nghiêm_trọng,0
1576,đọc tựa đề tưởng cá_mập trắng xử đẹp cá_voi coi hóng video dè công_nhận nhân_viên cứu_hộ viết vững tim,0
1577,mật_độ xây_dựng khu đường dày giao_thông tê_liệt nhiễm không_khí môi_trường ngoại sống sướng,0
1578,mua tiền mua thuê thuêsao giá chủ đầu_tư ôm ôm tiền lãi ngân_hàng bể chờ hehe,0
1579,hổng thị_trường chuộng công_nông,0
1580,thi thi thi mãi chứng_chỉ cảnh,0
1581,đầu_tư vàng ổn,0
1582,giai_đoạn đời gu âm_nhạc hồi ten nhạc trẻ sôi_động già bolero êm_ả một_chút hát tùy tâm_trạng nhạc hoàn_cảnh tự_nhiên kiểu buồn cảnh vui suy_tư_tình_yêu tan_vỡ không_lẽ nhạc đám_cưới hát dở tâm_trạng tùy,0
1583,chúc_mừng cố học giỏi đạo_đức,0
1584,bọn dã_man người_ta chạy truy giết tận di_đà phật,1
1585,hlw thành phim tuyệt cú_mèo,0
1586,xe trừ thùng tôn di_động,0
1587,nhà_vua buồn_rượi ' wakanda forever,0
1588,ăn_tiền bảo_hiểm công_ty bảo_hiểm đóng_cửa phá sảng ',0
1589,hai vợ_chồng viện khánh hòa vợ thai tuần thai kỳ ăn_uống đầy_đủ đi ăn_chay ăn_chay mua rau triệu thực_phẩm tươi chế_biến thực_phẩm chế_biến sẵn mạng rước_họa thân,0
1590,mặc áo sơmi quần_jean brioni cảm_giác khác_biệt xứng_đáng tiền,0
1591,vốn tỷ đồng doanh_thu triệu vnd lãi_ròng làm_chi trà sữa khỏe,0
1592,đọc người_lớn đánh trẻ_con ghét trường_hợp cha_mẹ bạo_hành_chính con_ruột tha_thứ,1
1593,mẹ sanh cơ_thể lành_lặn đầu_óc bình_thường may_mắn đi chẳng dám than_thở trách cha_mẹ chi,0
1594,quê mày trường_hợp tòa người_ta chia công chăm_lo ông_bà già hưởng chia,0
1595,kia soluto at deluxe giá niêm_yết đồng,0
1596,nghiêm răn_đe kẻ kẻ sẵn đầu_tư,0
1597,chào hai con_gái học lớp lớp tiểu_bang phát thưởng hiện điện_thoại học,0
1598,tiền tiền mua đất,0
1599,vật cảm_tính đôi_khi nhạy_bén con_người tấn_công nguyên_nhân sâu_xa con_người khắc_phục cố_tình sửa căng lưới biện_pháp tạm_thời chữa gốc,0
1600,bọn trẻ hatrick tuyệt hoi thống bàn thắng_vậy,1
1601,lý_thuyết bayern bà_xã vòng bảng mồi ngon nuôi béo thịt tứ_kết đẹp ghi_danh sử_sách,0
1602,đánh bùm bùm mềm chúc sức_khỏe hai cụ,0
1603,trưởng_phòng pháp_chế hiểu_biết pháp_luật kém rắp_tâm nhái nhận_diện vi_phạm người_ta bắt,1
1604,khúc ruột miền trung thương lắm,0
1605,đừng kiểu nhân_viên gọi tư_vấn lẽo nhẽo tài_xế đường lái_xe tập_trung_cao_độ gọi tư_vấn vân vân vay kịp đóng lãi kiểu làm_ăn điện_thoại khách_hàng gọi suốt goi làm_phiền nhát nửa tiếng từ_chối khéo lát gọi cúp ngang gọi bất lịch_sự,1
1606,gương_mặt thông_minh cảm_nhận đằng chúc thành_công đường học_tập mai_sau tài_giỏi giúp_ích gia_đình xã_hội mong mạnh_khỏe hiện_thực_hóa giấc mơ,0
1607,sinh_vật khổng_lồ hiếm_hoi,0
1608,trang cảnh_sát giao_thông dot việt nam góc tra_cứu phương_tiện vi_phạm điền hướng_dẫn kết_quả chúc_mừng,0
1609,lỗi quản_lý chất_lượng sảng phẩm trực_tuyến không_trách dân trách trách cơ_quan_chức_năng vụ thể kiểm_tra chất_lượng sảng phẩm trực_tuyến cớ,0
1610,mua xe trừ toyota,0
1611,mày giải giao_hữu,0
1612,mẹ mong yên_ổn ấm_áp,0
1613,nông_thôn nuôi mèo bắt chuột nuôi độ thịt thủ_phạm đa_phần thôn_xóm bẫy nạn chuột hoành_hành dám chết nhiễm,0
