Unnamed: 0,Free_text,Label_id
565,cám_ơn thầy quang nguyen slip động trượt ví_dụ trượt_tuyết trượt slip of the tongue idiom hữu thành_ngữ học slip of the tongue câu lịch_sự lỡ_lời định đường nẻo,0
566,đừng đỗ thừa bão trường_hợp chết bão an_toàn lợp mái,0
567,tuổi_thơ quê thăng bình qn,0
568,nuôi chó,0
569,thành_tích nể cố kịp cống_hiến câu lạc_bộ chủ_quản cống_hiến tổ_quốc dân_tộc phẩm_chất quý pele mara chẳng qbv phòng vua bóng_đá,1
570,tù tông chết án nhẹ,1
571,đồng_chí đi,0
572,đi giá quất sợ xe tai_nạn kiểm_tra kỹ xe hao xăng hãng chút_ít máy bốc xe chạy đầm,0
573,đời xd,0
574,đường_bay ca nhiễm hy_vọng lây cộng_đồng,0
575,hoan_nghênh ủng_hộ đề_xuất hội_đồng hoà_bình thế_giới đội_ngũ y bác_sĩ cuba đóng_góp hiệu_quả y_học sức_khoẻ thế_giới sự_thật tranh_cãi,0
576,huấn_luyện_viên hagl vận_hành kiểu thua,0
577,gia_đình ủng_hộ trump vé,0
578,da vàng ta lỡ đi nắng riết đen,0
579,thanh_xuân vơi bớt,0
580,chào anh_chị giá vàng hiện chiều_hướng nhẹ ổn_định gia_đình nhà_trọ cất nhà_trọ tương_tự giá vàng gia_đình ý_định lựa_chọn kịp_thời vàng giá tiền công thợ vật_tư rẻ cất họp lý,0
581,điện_ảnh đất_nước con_người,0
582,chạy bộ_môn lạc sức_khỏe lười_biếng chạy lạc vô_cùng tinh_thần thoải_mái phấn_chấn hạnh_phúc bụng bớp săn da_dẻ hồng_hào khỏe_khoắn hẳn bệnh thoái_hóa cột_sống nhức mỏi tay_chân khuyến_khích duy_trì chạy hàng,0
583,lành fan seltos theo_dõi đầu ra_mắt thị_trường nước_ngoài việt nam mừng lắm định cọc hộp_số ly hợp kép sợ sợ focus nội_thất lux chán,0
584,ngưỡng_mộ chồng,1
585,minh nhà_trường trách_nhiệm kinh_khủng lớp thủ_tục pháp_lý lớp liên_thông dang khổ nè,0
586,pháp_luật nghiêm xảy vụ_việc bạo_hành đầy_rẫy,0
587,game bắn súng bắn đối_thủ lệch chút trượt góc kéo không_thể_nào đường_cao đề_bài tổng_đuòng,0
588,người_ta thể_thao rèn_luyện sức_khỏe ngược_lại rủi_ro,0
589,kế_hoạch bảo_vệ di_tích lịch_sử thiết_kế đẹp mong mau sửa_chữa tham_quan,0
590,mãi fan mu chúc_mừng bayer mấy tài_khoản cãi_vã cực top lẻ đọc cay_vậy khoa_học ý_chí mạnh_mẽ chuyên_nghiệp có_nghĩa_là ghét mesi đọc cổ_vũ fan trù_dập đành_rằng ý_kiến cổ_vũ văn_minh đẹp đa_số anh_em anti mesi bình_luận khiêm_tốn fan mesi fan học tốt_đẹp hạn_chế trù_dập chẳng làm_bạn giỏi thông_minh giàu_có chúc bình_luận bóng_đá tinh_thần fairplay thể_thao,0
591,viết tác_giả,0
592,đẳng_cấp,0
593,suzuki ertiga,0
594,đội quân hồi giáo turk phá_hủy tu_viện phật_giáo nalanda đại_học nhân_loại,0
595,kỷ_luật hành_động tay_chân ngăn_cản ôm bé bé người_lớn tấn_công,0
596,việt nam gọi đơn_giản lốp ơn ngài đun lốp,0
597,trộm chó đánh xui,1
598,xe hàn nội ngoại_thất option kiểu giá tiền mua xe hàn,0
599,giết đền_tội,1
600,con_trai ielts thi lớp lớp lớp lớp luyện luyện áp_lực đi thi đọc khâm_phục tùng kiên_trì đức_tính thầy,0
601,hóa_chất bom bom làm_ơn đi khu dân_cư giúp bài_học việt nam,0
602,đọc mấy vụ án trung quốc cuốn_hút vụ hơi,0
603,tuyệt đại đa_số nước_ngoài chúc may_mắn god luck việt cụm thú_vị ổn,0
604,quê vô_địch olympia đi du_học trở việt_nam vô_địch vô_địch vô xứng_đáng mong du_học xong góp_phần xây_dựng quê_hương,0
605,túi giấy bảo_vệ môi_trường động_vật màng chống dính lót da bê,1
606,đẹp mãi cuộc_sống xô_bồ sống cảm_nhận cuộc_sống mấy hát xưa rơi nước_mắt,0
607,bổ_ích đoàn dũng huy dạy trẻ dạy bơi dạy leo_trèo phòng cháy xảy kẹt quên trẻ cẩn_thận,0
608,con_em trường phạm ngọc_thạch,0
609,vô_bổ cam lùi,1
610,chúc_mừng chiến_công công_an tội_phạm nguy_hiểm đề_nghị trang_bị bảo_vệ chiến_sĩ,0
611,ước nguyễn đình chiểu rồng bắc_nam hai trưng trương định đông tây thoáng_đãng xe bus điện xe_đạp đi,0
612,thành_lập tổ_chức chỗ như_vầy hoài đau_lòng chết,1
613,giả_sử chồng chồng đất tích tam_giác dữ_kiện ta bc khuyến_mãi bcông anca khuyến_mãi,0
614,xứng_đáng,0
615,quan_sát phiến_diện bạo_lực bé khai man buôn_bán thuốc đứa bé ngoan chống_cự cảnh_sát biện_pháp khống_chế trẻ_con đường sai_trái video câu_chuyện ủng_hộ cảnh_sát,0
616,đi santafe lux sa cộng chạy ổn bảo_dưỡng đắt xe vin giảm_giá giá chào tham_khảo đọc báo sảng xuất chấp_nhận lỗ xe định mua ford everest mượn xe đi chuyến lux sa cộng,0
617,hết_sức thận_trọng nhập_cảnh việt nam lọt ca cộng_đồng công_lao hàng vạn đổ sông đổ_bể,0
618,sale nhật xe hàn khách_hàng tiền mua xe trang_bị ọp sừn ngập,0
619,mấy bảo trộm chó thịt chó ví_dụ nuôi chim trộm đơn_giản chim cảnh thịt trộm chó cảnh,0
620,sơn duyên quỳnh yêu,0
621,quy_định phép đéo thoại sinh đấy tài_liệu thầy gửi mạng thông_tin chủ_yếu giải_trí phép trường học môn toàn thời_buổi công_nghệ học điện_thoại hay_ho,0
622,thương cháu bé_con chồng,0
623,tiểu_vy xinh_đẹp,0
624,bạo_hành bố_mẹ ma_túy ma_tuý chả nỡ đánh nghiện đừng đẻ,0
625,chúc_mừng ca rọ chuyên_án công_an mai_phục bắt lực_lượng kỹ,0
626,chia buồn đau_lòng,0
627,học trường trường kia mong tư_duy học nghiên_cứu_sinh khoa_học học đầu_tư chuyên_gia phân_tích kinh_tế tóm_lại thành_tích mong đời an yên vui,0
628,hình_phạt giam_giữ răn_đe tội bảo_vệ,0
629,trump nhiễm covid người_ta lo_ngại vận_động tranh_cử tranh_luận biden hồi_phục nhanh_chóng chứng_tỏ covid ghê_gớm lắm lối sống lành_mạnh bệnh sẵn ngườị con_số bầu trump bệnh theo_dõi biến_động_kinh_tế tài_chính trump nhẹ tình_hình đi dấu_hiệu tiêu_cực phát_biểu trump thị_trường chứng_khoán suy_sụp,0
630,to thịt cá_trê bé tẹo nhục,1
631,xong mùa cá sa toang đòi món nợ thua tứ_kết,0
632,italy màn acid,0
633,di_tích lịch_sử quảng_bá kênh du_lịch,0
634,đứa,0
635,barca kết_thúc trận_đấu chiến_thắng đối_thủ hạng la liga griezman đệm_bóng đơn_giản đánh_bại thủ_môn badia goal griezman sa thắng cules tung đệm_bóng cận_thành đơn_giản mần cules chê goal,0
636,biden yếu nhiễm tranh_luận trump tái_cử,0
637,tội chỗ vui_chơi hồ bơi thiếu_nhi nông_thôn tắm ao hồ nguy_hiểm,0
638,thương năm_học nam_mô di_đà phật cầu_mong linh_hồn siêu_thoát,0
639,mới_đầu định mua santafe lái thử dòng xe foturner everet crv sa đơn_giản hợp chạy ngon mấy xe ke cách_âm nhược_điểm nội_thất đẹp lắm màn_hình hơi mờ độ bền cho_dù dở ngang xe hàn tùy_bác lái thử xe quyết_định,0
640,ác nhân ác báo,0
641,mãnh đất đứng_tên bìa đỏ mẹ chủ sở_hữu chia đứng_tên chủ sở_hữu miếng đất cửa,0
642,hấp_dẫn,0
643,phân_bón nổ bom,0
644,thương quá_khứ đau_thương,0
645,tro cốt chậu hình tên_tuổi quê_quán,0
646,trừ thành_phố lương công_việc cầm tiền quê mua đất sống khoẻ thành_phố chật_chội khói bụi kẹt xe ham,0
647,sam biển,0
648,đóng thuế tỷ_phú mỹ giá nhãn dán nhãn tiền thuế trump,0
649,chúc_mừng việt_nam chiến_thắng dịch_bệnh bệnh_viện nâng cảnh_giác đề_nghị bệnh_nhân nhập_viện xét_nghiệm chung_quanh,0
650,bình_thường chó nuôi cỡ phích nằm thẳng_cẳng hôm đổ rác hàng_xóm sợ xích mèo mấy hôm,0
651,bé xách yêu điệu đợi cưng hà,0
652,chúc nghệ_sỹ khỏe quê_hương đất_nước,0
653,mong_chờ đối_đầu everton tottenham,0
654,sảng phẩm tin_dùng thường_xuyên kiểm_tra atvs thành_phố hại sức_khỏe tính_mạng con_người hậu_quả đem phá sảng trách_nhiệm hình_sự,0
655,chào vọng trump nhiệm_kì tổng_thống mĩ,0
656,suit brioni may kỳ_công đẹp tuyệt_đỉnh công_phu,0
657,đệ cứng vây_cánh hà_lan đổ_bộ thế_lực cứng dám bật si,0
658,cà_cưỡng nuôi tu_hú ',0
659,mấy đơn_giản,0
660,giáo_viên dạy bơi kỹ_năng an_toàn làm_việc giáo_viên úc canada dạy bơi kỹ_năng nhỏ_bé đọc ruột_gan thắt con_em xót_xa,0
661,bào_ngư hàn quốc tươi chợ hàn mỹ giá usd vnd,0
662,tui tài_khoản ngân_hàng ký chữ_ký nhân_viên ngân_hàng an_toàn khó_chịu tui đấy,0
663,tội_nghiệp bơi_lội kỹ_năng sống đi_nữa quên học bơi sai_lầm hề nhỏ_con đứa bơi đầu hố cháu bơi giỏi cháu tự_tin đi biển huấn_luyện_viên cháu tư_thế cơ_bản cứu,0
664,ý_vị_trí thụy điển bảng xếp_hạng tụt dần miễn_dịch cộng_đồng mùa đông loay_hoay phong_tỏa mở_cửa,0
665,ozil mất_tích đi câu lạc_bộ thể_hiện james rodríguez,0
666,nước_mắt tự_nhiên khóc rơi,0
667,máy chạy tuột dép kịp máy trung quốc nhật,1
668,ngành giáo_dục môn bơi_lội môn bắt_buộc học_sinh tiểu_học trung_học cơ_sở rèn_luyện sức_khoẻ thể_lực cháu trang_bị kỹ_năng sinh_tồn trẻ giáo_dục thể_chất môn môn thiết_thực bơi_lội đa_phần chương_trình trường,0
669,luật nhẹ tội trôm gà trộm chó dân bức_xúc lắm mong pháp_luật sửa_đổi luật phật đi tù chừa tội trôm cắp,0
670,đi dạng thả nguy_hiểm lắm,0
671,cá xấu đi kiếm_ăn gà kém,0
672,hoàn_tất cú thần_thánh barca cố tình_yêu phục anti barca cú barca hề đơn_giản tôn_trọng thay_vì cạnh khóe thân,0
673,lux sa công_nghệ đức hàn xe đứng cạnh lux sa vững chải,0
674,đồng_tình ý_kiến nêu nghiêm_túc qui trách_nhiệm phòng_chống dịch cộng ý_thức dân,0
675,chế_tài cầu cung sự_thật phũ_phàng,0
676,giọng hát nhạc hoa kỹ_thuật mấy nhueng chất giọng hợp hát hồn hát phong_cách kiểu hà tuấn ức_chế hợp xíu fan bo thập kỹ thế_hệ bo hát dòng nhạc bolero dân_ca ổn,1
677,lo có_học tiếng ham đọc truyện_tranh đi mỹ,0
678,mulan độ chín kì_vọng đa_phần mulan huyền_thoại có_lẽ tướng nữ lừng_danh trung quốc cổ_xưa hành_động võ_thuật phim thu_hút phim ngấp_nghé hư_cấu lịch_sử hư_cấu hư_cấu hẳn lịch_sử phim trung quốc,1
679,giải nam phụ xuất_sắc phim,0
680,bhnt tư_vấn tâm tham_gia,0
681,chào vọng thiệt_hại tài sảng mưa,0
682,chích điện hình_như sao_chép bản_quyền,0
683,chích ngừa bé theo_dõi đem bé đi gởi tội,0
684,tuổi_thơ dữ_dội quảng_nam thân_yêu,0
685,vẻ xe_bồn thắng,0
686,mong đừng đà_nẵng dịch covid lắng trận bão thương đà_nẵng,0
687,học_sinh hệ thốg kiến_thức,0
688,chạy kéo_em chạy fulmaraton,0
689,tuyệt_vời,0
690,đề_nghị công_khai danh_sách cơ_sở y_tế vi_phạm_quy_định phòng_dịch,0
691,cầu_mong đứa trẻ bạc phước xã_hội giúp_đỡ cháu tận_cùng nổi khổ,0
692,đại_lý đánh tâm_lý mua xe đầu kiếm_chác tí phụ_kiện rẻ_tiền hãng giá gấp đôi,1
693,đời tui chạy,1
694,công_cuộc nuôi dạy trẻ bà_xã hơi vất_vả,0
695,yêu_tinh cá xấu xd,0
696,xác_định đi thành_phố đi tỉnh triệu xe hạng nhật tiêu_chí giá tiết_kiệm xăng hỏng vặt đổi độ tiện_nghi cảm_giác lái nhạy liệt atrage mitsu xăng tiết_kiệm xe nhẹ lái trông hơi cổ_điển con_gái cân_nhắc brio tầm tiền thương_hiệu bắt_mắt giá hơi phân khúc,0
697,tận đáy đội_ngũ điều_dưỡng y bác_sĩ chữa bệnh cứu,0
698,đề_xuất quy_định chứng_minh nhân_dân ngân_hàng quyền tra soát cổng thông_tin tín_dụng quốc_gia cic kiểm_tra sức_khỏe định_kỳ phát_hiện bệnh trường_hợp đi vay vốn ngân_hàng khởi_nghiệp té_ngửa mắc nợ xấu,0
699,đoán mơ_hồ trump mạnh_khỏe trở_lại,0
700,lái thử xong cơ_bản ngang chủ_yếu khác_biệt option,0
701,tiền_án tiền_sự tái_phạm tổ_chức đề_nghị xử nghiêm hẳn tù,0
702,quê nam định lắm thuốc trừ_sâu chả táng cá đồng rô phi sống,0
703,bão lồn hoàn_lưu kéo mây đi mưa tâm_bão đi,0
704,giàu tài,0
705,mãi chỗ xe kèm phụ_kiện em_gái xinh_đẹp đứng cạnh trông xe triển_lãm ô_tô,0
706,công sinh công dưỡng,0
707,hứa phim ra_mắt đi phim nằm viện điều_trị xin_lỗi,0
708,khâu nguyên_liệu thị_trường cốt_lõi tài sảng công_ty sảng xuất,0
709,buồn_cười lịch_sử real bale giỏi xưa siêu_sao công_thần real lẳng_lặng đi sợ,0
710,cú nhừ xương choáng ngất sức chạy đi nằm yên mời xơi,0
711,phát_triển hữu_ích tiện,0
712,án nhẹ thời_đại ngày_nay giới trẻ tiếp_xúc thông_tin nhanh_nhạy khả_năng tư_duy trưởng_thành lớp án vị thành_niên sức răn_đe,0
713,hậu_quả coi_thường dịch_bệnh lây_nhiễm,1
714,thời bo trời đất đỡ ha_ha,0
715,cắt tóc đi đẹp,1
716,tội_nghiệp bình an,0
717,lường kịch_bản mesi triệu_hồi coutinho dự tổng_tỉ_số vòng đi kiến_tạo bàn thắng lượt cu tí,0
718,đơn_giản tiền miễn_là trung quốc tập_đoàn kiếm tiền tiền chẳng đi trump đền_bù thiệt_hại rời trung quốc tiền_mặt có_lẽ đấyvà vụ trump sảng xuất mỹ áp_thuế_ép đơn_giản để_dành phiếu bầu ta chẳng ta lỡ đắc_cử tổng_thống,0
719,chẳng văn_minh kiểu cách_ly dập dịch,0
720,thánh lỗi fadil sửa_chữa bảo_dưỡng tốn phết chả,0
721,tiếng đức tập nxb mua bản_quyền việt_hóa truyện đọc sách bổ_ích truyện_tranh nhật bát_nháo,0
722,khởi_tố vụ án,1
723,tiền,0
724,đừng con_trẻ hậu_quả người_lớn sai,0
725,cơ_quan_chức_năng,0
726,chúc_mừng triệu chủ,0
727,tổng_thống miễn mỹ vững siêu_cường thế_giới,0
728,phi_lí thu_nhập bình_quân đầu chậm covid giá nhà_đất vùng_ven quỹ đất,0
729,đau_lòng mong siêu_thoát mong trường xây bể_bơi môn bơi_lội học lớp quê tây nguyên trường môn bơi_lội,0
730,đau nhức xương khớp lớn_tuổi bơi_lội môn thể_thao thay_thế chạy sức_khỏe hòa dòng nhẹ_nhàng êm_ái uyển_chuyển,0
731,lọt_lòng ngậm thìa vàng món đồ bé tích_lũy đời,0
732,thông_báo ngưng sử lỡ mua đem giao_nộp cơ_quan y_tế,0
733,cầu_mong khỏe_mạnh,0
734,hà chương thương lắm đồng_hương quảng_ngãi việt_kiều quê_hương đất tổ,0
735,tương_lai fe công_ty vay fe,0
736,mâu_thuẫn đánh phạt bọn côn_đồ,0
737,trụ_sở đẹp đấy bến_xe miền đông bí,0
738,bác_sĩ,0
739,đàn cá_mòi ngon bữa tiệc biển_cả việt_nam,0
740,barca đội trụ hạng ghi bàn gỡ,0
741,đừng mua vios,0
742,joly thế_giới,0
743,bé lớp môi_trường_học_tập mầm_non tiểu_học bỡ_ngỡ chương_trình cháu thích_nghi tiên chơi_đùa khám_phá cặm_cụi học đề_nghị thành_viên ban soạn_thảo chương_trình giáo_dục dạy sách giáo_khoa thấu_hiểu nổi khổ cháu học_sinh giáo_viên cha_mẹ gánh chương_trình học kiến_thức độ,0
744,đi soluto đẳng_cấp tinh_tế thông_minh,0
745,nghèo lắm hồi cơm bào_ngư thay cơm tiền mua trái_cây mua nho nhật quá_bữa uống uống tạm rựu vang xe_đạp đi học lái land rover trường tóm nghèo_khổ lắm xd,0
746,cầm chai uống tắc_trách người_lớn,0
747,cảnh oái_oăm mẹ vướng vòng lao_lý bố xạo bạo_hành ngoại che_chở mong cuộc_sống yên_ổn học_hành chăm ngoan,0
748,tiết học ngoại_khoá học_sinh,0
749,mạ tui dà may bạo,0
750,kiến_thức ngoại_ngữ giới_hạn ielts lĩnh_vực chuyên nghành xây_dựng y_khoa lưu_loát,1
751,công_dụng tìm_kiếm mất_tích leo núi truy_lùng tội_phạm ẩn_nấp,0
752,chẳng có_ích cha_mẹ hung_hăng tai_tiếng,1
753,video nữ nhân đi giày gót chục chết mẹ đứng mấy ngón chân chẳng_trách vị kêu giời đau chân ngón chân trông xấu biến_dạng,0
754,eo ghê đĩa tiết_canh ngon_thế,1
755,chúc_mừng mái xưa,0
756,nước_giải_khát đa quốc_gia hoạt_động_kinh_doanh suốt hai chục doanh_thu hàng tỷ usd báo lỗ,0
757,phạt đè cảm_giác,0
758,lối đá juve thắng samdoria bình_thường,0
759,bắt sam chết,0
760,bảng giải_thoát auba đi người_ta tìm_kiếm phương trời ví_dụ barca tập tạ chẳng_hạn,0
761,mong cơ_quan_chức_năng thu thuế đầy_đủ đại_gia,0
762,rõ_ràng biển biển quy_định làn_đường ví_dụ làn xe_máy làn xe_tải biển quy_định_hướng đi làn_đường tức_là đi thẳng đi làn đi thẳng rẽ trái đi làn rẽ trái rẽ trái đi làn đi thẳng sai làn,0
763,so_sánh bảo khập_khiễng học pháp lớp lớp tập vẽ chữ tập đọc bánh ươm mắc điện đơn_giản khoe bố_mẹ việt nam lớp đọc thông viết thạo thi lớp cháu đọc viết lớp học tuần nghỉ tuần đi trang_trại nhà_máy công_viên nghỉ học học học xong trường công_nhân quản_lý học việt nam học học học đi thi kết_quả nấu cơm luộc rau lắp_ghép đồ_dùng hàng thử_hỏi kiến_thức cuộc_sống,1
764,tuổi_thơ quên quên ngủ săn đọc truyện tứ quái tái_bản mua đọc,0
765,tư_duy ngược_lại biến_đổi khí_hậu trái_đất có_lẽ ' ủng_hộ ' loài động_vật hại ' giỏi ' thích_ứng biến_đổi bọn chuột chuột_cống chuột_đồng ' thích_nghi quậy ' khắp đô_thị nông_thôn đồng_ruộng nới rục_rịch bệnh_dịch_hạch thông_tin họ_hàng chuột sắp_sửa chào_đón đồng_nghiệp ' super chuột ' trang_bị tổng_hợp kỹ_năng chuột_đồng chuột_chù chuột núi hắn đổ_bộ thành_phố học kỹ_năng ' đột_biến ' chuột_cống bọ_chét chuột hic,0
766,li_hôn xấu nghệ_sĩ hôn_nhân đời khắt_khe cổ_hủ đôi đồng_ý chia_tay hợp_lý văn_minh êm_đẹp giả_dối gượng_gạo bức_xúc bôi_nhọ xấu,1
767,tuyệt_vời tuổi_thơ hồi mua_lẻ_tẻ tiết_kiệm tiền tái_bản học đại_học đều_đặn nhà_sách phố triệu mua trọn thỏa_nổi đam_mê đọc nát quyển tập nhà_văn phóng_tác truyện đọc hình_dung thân_thuộc tuổi_thơ dữ_dội truyện chữ đọc ngấu_nghiến truyện_tranh d điểm_danh tuổi_thơ đẹp đẻ,0
768,remdesivir thuốc duy_nhất chứng_minh hiệu_quả khoa_học ngăn phát_triển replicate cơ_thể tuyên_bố phản_khoa_học mắc bệnh chữa_trị phương_tiện khoa_học tối_tân ' đừng ta ta ',0
769,khắc_phục đuối trẻ_em dậy bơi trẻ vô trách_nhiệm người_lớn đứa trẻ bơi nghịch ao người_lớn nhắc_nhở canh_chừng,0
770,sống khu_vực ngập,0
771,trump tiêu_chí mỹ hàng mỹ doanh_nghiệp yên_tâm dân mỹ mua tổn_thất khoản lỗ trump lo nhân_công yên_tâm dân lao_động mỹ lương dân mỹ đất_nước vĩ_đại văn_minh thế_giới tay_nghề chuyên_môn bàn ráng kéo trump kiếm phiếu bầu trump lo trình_bày ý_kiến đường_lối trump fan cuồng đừng ném đá,0
772,chết hu_hu uống nhầm bia saigon dạo lạ lạ,0
773,bayern munich lối hiện_đại tốn sức hiệu_quả kết_hợp nhuần_nhuyễn presing kiểm_soát bóng phá vỡ chiến_thuật phòng_ngự phản_công sevila,0
774,cup mặc_định manchester city,0
775,qúa thương_tâm chia buồn gia_đình cháu,0
776,án hơi tố tội giết trạng_thái kích_động đi gái gái độc_thân pháp_luật đi bảy lượt chạy trốn thoát chết may_mắn gấy hấn nạn_nhân,0
777,cara,0
778,khâu kiểm_tra vệ_sinh an_toàn thực_phẩm mong nạn_nhân bình_phục,0
779,đọc thông_minh vắt kiệt_sức_lực cháu đọc bức_xúc,1
780,đội thua nát barcelona người_ta bàn danh_dự chẹp,0
781,nguy_hiểm canh đêm canh sinh hàng_xóm,0
782,đại_học ngưỡng_mộ,0
783,trời mưa nguyên,0
784,tiền lux sa kí hợp_đồng hợp_tác vượng an_tâm hậu_mãi phụ_tùng rẻ bèo sẵng ertiga nằm chờ phụ_tùng lux sa xe bmw thay form tội tiền thử chạy đổi,0
785,hơi nhậy_cảm,0
786,mặc_dù chất_lượng trung quốc lắm công_nhận mấy món giỏi,0
787,bơi nguy_hiểm mặt áo_phao bờ bơi một_mình người_lớn giải_thích trẻ_con nguy_hiểm,0
788,hóng chờ háo_hức hải option cắt sạch luxury seltos giá tương_đương kona option chả túi khí cân_nhắc kona vote kona vé,0
789,trump mắt fan,0
790,mừng miền trung chờ mưa bữa,0
791,trump nhiệm_kì tổng_thống,0
792,mặt_khác xài gòn hoa_lệ,0
793,con_số triệu nhiễm tiến con_số triệu đầu kèm chết bé_nhỏ thế_giới điên_đảo dừng,0
794,mong thành_tài đóng_góp trí_tuệ xây_dựng đất_nước,0
795,bận lắm ngoi ổn,0
796,toàn giỏi toán coment đọc lướt chóng mặt,0
797,bất_động_sản nhu_cầu bong_bóng bất_động_sản sảy bất_động_sản cho_dù ngắn lãi_suất đỉnh_cao kênh trú_ẩn tài sảng an_toàn ý_kiến đi mua đất đầu_tư video trường_hợp đỉnh sốt đất chạy dư án sân_bay long thành mua đất bong_bóng sốt đất sảy đất hề đứng trí vỡ_nợ giá video điển_hình gửi thằng có_lẽ tiền cộng chẳng mua đuọc lô đất vãi đái đầu_tư lô đất nhuận đi ts chúc may_mắn,0
798,cá_mập cá_voi sát_thủ làm_thịt gà biển đối_thủ xứng tầm,0
799,phương_án hai tối đấu nối thành_phố tương_đối,0
800,chúc thành_công học_tập cuộc_sống đóng_góp đất_nước,0
801,mua con_một,0
802,mua bảo_hiểm_tỷ tự_tin mua,0
803,đi học kịp chương trìnhtrên lớp học kịp àtrên lớp học ngôi_sao ghi_nhận bảng thành_tích tuần học đầu đọc đánh_vần viết kém sổ theo_dõi đọc kém viết kém,0
804,cách_ly sân_bay thành_phố giúp,0
805,trường quản_lý cấm học_sinh trừ sinh_viên lớp,0
806,phản_ứng kịp xem_xét_lại,0
807,hèn trông xinh,0
808,quỷ đội_lốt kinh_tởm,1
809,tầm tiền kona quất đi kona cảm_nhận ổn xứng_đáng giá tiền seltos dịp thử mê nổi xe toàn nhựa ọp_ẹp,0
810,dựa coment ta suy cạnh hình_vuông chết mẹ,0
811,chúc_mừng barca cầu_thủ lắm khởi_đầu mỹ_mãn đập_tan tin_đồn thất_thiệt chứng_minh sân_cỏ tái_thiết barca đi hướng con_người,0
812,người_ta tiền mua cao_cấp đi tặng đi biếu cầu cung vertu đấy chức_năng dát vàng dát kim_cương đẳng_cấp bánh trung_thu ngon đẹp cao_cấp chứng_minh đời_sống bộ_phận dân nâng,0
813,biden tự_tin,0
814,bale laliga chê ngoại_hạng công_kích bóng_đá phong_độ xuống_dốc sân thi_đấu real madrid mong cầu ngoại_hạng premier league giải_đấu hấp_dẫn hành_tinh chẳng đội bóng mãi đỉnh bàng laliga bundesliga type kiêu_căng ngạo_mạn đoạn đường liệu xấu_hổ,0
815,video âm_nhạc cô_dâu diễn_viên thức xong cưới liền,0
816,ghé,0
817,đề_cử đúng_đắn,0
818,độ cạnh hình chữ_nhật,0
819,hệ_thống thoát bệnh_viện tệ_hại,1
820,tui sớn_sác đọc kỳ kỳ coi sevila barca ha,0
821,china động_thái,0
822,ca_khúc lấn dòng nhạc âm_hưởng dân_ca nội mẹ nao,0
823,bé xinh_đẹp thương_tiếc_thương hành_tinh đi xinh_đẹp chia buồn gia_đình đất_nước hàn,0
824,khóc,0
825,cầu phương_tiện lưu_thông làn_đường,0
826,hy_vọng tân vô_địch,0
827,di_đà phật thương cầu_mong siêu_thoát,0
828,hà_nội đá dự_đoán bao trái,0
829,xe hỏng vặt mua xe cũ đòi hỏng vặt mua xe cũ thử vận may đừng mong_đợi,0
830,hai thiệt_hại nè dân_chủ_quan hai do_dự_báo sai_lệch đường đi bão đổ_bộ đất_liền,0
831,trump nhiệt_huyết tận_tâm mỹ mỹ tổng_thống mỹ obama bil clinton độ ta tiền_nhiệm trump làm_việc,0
832,real mua_bán khôn,0
833,cháu lo sức_khỏe cháu,0
834,mục_đích đàn_ông ngồi_tù giết_hại động_vật khả_năng phản_kháng hèn_hạ,1
835,thần_tượng fan đông,0
836,kỳ_lạ đọc lướt kỹ tưởng dương_tính covid đọc kỹ dương_tính ma_tuý thở_phào nhẹ_nhõm,0
